{
  "request_id": "r5",
  "reply": "You can ask FEMA how to verify your identity. FEMA makes the decision.",
  "citations": [{"title": "Verify identity, occupancy, or ownership", "url": "https://www.fema.gov/assistance/individual/after-applying/verify-identity-occupancy-ownership"}],
  "handoff": null
}
